{
  "schema_version": "anchor.synthetic-nl-scaffold-closed-grammar.v1",
  "source_namespace": "anchor.synthetic-nl-scaffold-diagnostic.v1",
  "languages": ["en", "zh-CN"],
  "roles": ["planner", "tool_policy", "frontend_gen", "frontend_review", "security_gate"],
  "variants": ["json_only", "concise_rationale_plus_json"],
  "ablation_labels": ["q_only", "q_plus_o", "wide_lora"],
  "route_fields": ["role", "expert", "goal", "constraints", "allowed_segment_refs", "evidence_segment_refs", "tool_plan", "acceptance_criteria"],
  "tool_action_prefix": "inspect_synthetic_",
  "tool_trace_mode": "harmless_synthetic_fixture_trace",
  "templates": {
    "en": {
      "planner": {
        "instruction": "Produce only a bounded execution route for downstream experts.",
        "summary": "The route fixes dependencies and acceptance checks before expert work begins.",
        "goal_prefix": "Plan"
      },
      "tool_policy": {
        "instruction": "Classify the synthetic tool plan and state the allowed local actions.",
        "summary": "The policy permits only harmless synthetic, local, and deterministic actions.",
        "goal_prefix": "Authorize a safe local plan for"
      },
      "frontend_gen": {
        "instruction": "Specify the frontend implementation deliverable and deterministic checks.",
        "summary": "The implementation contract preserves the task constraints and observable checks.",
        "goal_prefix": "Define the implementation contract for"
      },
      "frontend_review": {
        "instruction": "Review the committed implementation contract and list required corrections.",
        "summary": "The review compares the committed contract with its explicit acceptance criteria.",
        "goal_prefix": "Review the committed contract for"
      },
      "security_gate": {
        "instruction": "Issue a final diagnostic pass or block decision using only committed evidence.",
        "summary": "The final gate uses committed evidence and makes no claim beyond this proxy task.",
        "goal_prefix": "Gate the committed result for"
      },
      "acceptance_criteria": [
        "The role and expert are explicit.",
        "Every acceptance check is deterministic.",
        "No external body, network, or real tool is required."
      ]
    },
    "zh-CN": {
      "planner": {
        "instruction": "只输出有边界的执行路由，供后续专家使用。",
        "summary": "该路由在专家开始工作前固定依赖关系与验收检查。",
        "goal_prefix": "规划"
      },
      "tool_policy": {
        "instruction": "判定合成工具计划，并说明允许的本地操作。",
        "summary": "该策略只允许无害、合成、本地且确定性的操作。",
        "goal_prefix": "审批本地安全操作："
      },
      "frontend_gen": {
        "instruction": "给出前端实现交付物与确定性的检查条件。",
        "summary": "实现契约保留任务约束与可观察的检查条件。",
        "goal_prefix": "定义实现契约："
      },
      "frontend_review": {
        "instruction": "审查已提交的实现契约，并列出必须修正的内容。",
        "summary": "审查将已提交契约与明确的验收条件逐项比较。",
        "goal_prefix": "审查已提交契约："
      },
      "security_gate": {
        "instruction": "只依据已提交证据给出最终诊断通过或阻断结论。",
        "summary": "最终门只使用已提交证据，且不把代理任务冒充正式结论。",
        "goal_prefix": "最终门控："
      },
      "acceptance_criteria": [
        "明确给出角色与专家。",
        "每项验收检查都必须是确定性的。",
        "不需要外部正文、网络或真实工具。"
      ]
    }
  },
  "claim_boundary": {
    "diagnostic_only": true,
    "formal": false,
    "training_authorized": false,
    "hidden_chain_of_thought": false
  }
}
